{
  "schemaVersion": 1,
  "dataVersion": 1,
  "buildHash": 4237932526,
  "spawnLoadout": {
    "startGold": 10000,
    "startLevel": 6,
    "startRune": "LethalTempo",
    "startRuneCount": 0,
    "respawnDelaySec": 3.0
  },
  "championCollider": {
    "bodyHeight": 1.8,
    "bodyOffsetY": 0.9
  },
  "structure": {
    "turretMaxHp": 3000.0,
    "inhibitorMaxHp": 4000.0,
    "nexusMaxHp": 5500.0,
    "turretAI": {
      "attackRange": 7.75,
      "attackCooldownMax": 1.0,
      "attackDamage": 150.0,
      "nexusAttackDamage": 180.0,
      "projectileSpeed": 18.0,
      "turretSightRange": 12.0,
      "structureSightRange": 10.0,
      "bodyHeight": 2.5,
      "bodyOffsetY": 1.25
    }
  },
  "defaultJungleCamp": {
    "maxHp": 450.0,
    "radius": 1.0,
    "attackRange": 1.7,
    "attackDamage": 40.0,
    "attackCooldown": 1.4,
    "moveSpeed": 4.0,
    "baseArmor": 20.0,
    "baseMr": 20.0,
    "aggroRange": 3.0,
    "leashRange": 9.0
  },
  "jungleCamps": [
    {
      "subKind": 0,
      "maxHp": 8000.0,
      "radius": 2.5,
      "attackRange": 4.0,
      "attackDamage": 120.0,
      "attackCooldown": 1.2,
      "moveSpeed": 2.5,
      "baseArmor": 20.0,
      "baseMr": 20.0,
      "aggroRange": 2.5,
      "leashRange": 8.0
    },
    {
      "subKind": 1,
      "maxHp": 5000.0,
      "radius": 2.2,
      "attackRange": 3.0,
      "attackDamage": 90.0,
      "attackCooldown": 1.5,
      "moveSpeed": 4.0,
      "baseArmor": 20.0,
      "baseMr": 20.0,
      "aggroRange": 2.5,
      "leashRange": 8.0
    },
    {
      "subKind": 2,
      "maxHp": 2300.0,
      "radius": 1.2,
      "attackRange": 2.0,
      "attackDamage": 65.0,
      "attackCooldown": 1.4,
      "moveSpeed": 4.0,
      "baseArmor": 20.0,
      "baseMr": 20.0,
      "aggroRange": 3.0,
      "leashRange": 9.0
    },
    {
      "subKind": 3,
      "maxHp": 2300.0,
      "radius": 1.2,
      "attackRange": 2.0,
      "attackDamage": 65.0,
      "attackCooldown": 1.4,
      "moveSpeed": 4.0,
      "baseArmor": 20.0,
      "baseMr": 20.0,
      "aggroRange": 3.0,
      "leashRange": 9.0
    },
    {
      "subKind": 4,
      "maxHp": 450.0,
      "radius": 1.0,
      "attackRange": 1.6,
      "attackDamage": 40.0,
      "attackCooldown": 1.6,
      "moveSpeed": 3.8,
      "baseArmor": 20.0,
      "baseMr": 20.0,
      "aggroRange": 3.0,
      "leashRange": 9.0
    },
    {
      "subKind": 5,
      "maxHp": 450.0,
      "radius": 1.2,
      "attackRange": 2.0,
      "attackDamage": 40.0,
      "attackCooldown": 1.4,
      "moveSpeed": 4.0,
      "baseArmor": 20.0,
      "baseMr": 20.0,
      "aggroRange": 3.0,
      "leashRange": 9.0
    },
    {
      "subKind": 6,
      "maxHp": 450.0,
      "radius": 0.9,
      "attackRange": 1.5,
      "attackDamage": 40.0,
      "attackCooldown": 1.3,
      "moveSpeed": 4.6,
      "baseArmor": 20.0,
      "baseMr": 20.0,
      "aggroRange": 3.0,
      "leashRange": 9.0
    },
    {
      "subKind": 7,
      "maxHp": 450.0,
      "radius": 0.8,
      "attackRange": 1.5,
      "attackDamage": 40.0,
      "attackCooldown": 1.2,
      "moveSpeed": 4.4,
      "baseArmor": 20.0,
      "baseMr": 20.0,
      "aggroRange": 3.0,
      "leashRange": 9.0
    },
    {
      "subKind": 8,
      "maxHp": 450.0,
      "radius": 0.7,
      "attackRange": 1.4,
      "attackDamage": 40.0,
      "attackCooldown": 1.25,
      "moveSpeed": 4.5,
      "baseArmor": 20.0,
      "baseMr": 20.0,
      "aggroRange": 3.0,
      "leashRange": 9.0
    },
    {
      "subKind": 9,
      "maxHp": 450.0,
      "radius": 0.7,
      "attackRange": 1.4,
      "attackDamage": 40.0,
      "attackCooldown": 1.25,
      "moveSpeed": 4.5,
      "baseArmor": 20.0,
      "baseMr": 20.0,
      "aggroRange": 3.0,
      "leashRange": 9.0
    },
    {
      "subKind": 10,
      "maxHp": 450.0,
      "radius": 0.7,
      "attackRange": 1.4,
      "attackDamage": 40.0,
      "attackCooldown": 1.25,
      "moveSpeed": 4.5,
      "baseArmor": 20.0,
      "baseMr": 20.0,
      "aggroRange": 3.0,
      "leashRange": 9.0
    }
  ],
  "defaultMinion": {
    "moveSpeed": 4.0,
    "attackRange": 1.5,
    "sightRange": 12.0,
    "attackDamage": 40.0,
    "attackCooldownMax": 1.666667,
    "maxHp": 225.0
  },
  "minions": [
    {
      "roleType": 0,
      "moveSpeed": 4.0,
      "attackRange": 1.5,
      "sightRange": 12.0,
      "attackDamage": 40.0,
      "attackCooldownMax": 1.666667,
      "maxHp": 225.0
    },
    {
      "roleType": 1,
      "moveSpeed": 4.0,
      "attackRange": 8.0,
      "sightRange": 14.0,
      "attackDamage": 60.0,
      "attackCooldownMax": 2.0,
      "maxHp": 225.0
    },
    {
      "roleType": 2,
      "moveSpeed": 3.5,
      "attackRange": 10.0,
      "sightRange": 16.0,
      "attackDamage": 40.0,
      "attackCooldownMax": 1.666667,
      "maxHp": 225.0
    },
    {
      "roleType": 3,
      "moveSpeed": 5.0,
      "attackRange": 2.0,
      "sightRange": 14.0,
      "attackDamage": 100.0,
      "attackCooldownMax": 1.666667,
      "maxHp": 500.0
    },
    {
      "roleType": 4,
      "moveSpeed": 5.2,
      "attackRange": 2.2,
      "sightRange": 14.0,
      "attackDamage": 80.0,
      "attackCooldownMax": 1.0,
      "maxHp": 750.0
    }
  ],
  "minionBehavior": {
    "pathAgentRadius": 0.5,
    "laneClearanceRadius": 0.5,
    "softSeparationRadiusScale": 0.65,
    "softSeparationWeight": 0.35,
    "defaultSeparationWeight": 0.55,
    "softSeparationMaxStep": 0.18,
    "lanePathRebuildIntervalSec": 1.0,
    "chasePathRebuildIntervalSec": 0.2,
    "pathTargetRefreshDistanceSq": 0.1225,
    "pathWaypointArriveRadius": 0.35,
    "flowFieldProgressSlackSq": 0.01,
    "structureAcquireRangePadding": 0.75,
    "targetScanIntervalSec": 0.15,
    "attackExitRangePadding": 0.18,
    "meleeAttackWindupSec": 0.3666667,
    "rangedAttackWindupSec": 0.4666667,
    "attackRecoverySec": 0.3666667,
    "pathBuildBudgetPerTick": 4,
    "blockedFramesBeforeRepath": 6,
    "flowFieldStallFramesBeforePathFallback": 4,
    "targetScanStaggerBuckets": 10,
    "rangedRoleType": 1
  },
  "minionWave": {
    "waveIntervalTicks": 900,
    "initialDelayTicks": 300,
    "perMinionDelayTicks": 10,
    "siegeWavePeriod": 3,
    "timeGrowthPerMinute": 0.025,
    "timeGrowthCapMinutes": 30,
    "rangedProjectile": {
      "speed": 14.0,
      "hitRadius": 0.45,
      "forwardOffset": 0.45,
      "spawnHeight": 0.85,
      "maxDistancePadding": 2.0
    },
    "corpseDeathTimerSec": 1.5,
    "startX": 5.0,
    "formationSlots": [
      {
        "roleType": 0,
        "forwardOffset": 3.6,
        "sideOffset": -0.9
      },
      {
        "roleType": 0,
        "forwardOffset": 4.8,
        "sideOffset": 0.0
      },
      {
        "roleType": 0,
        "forwardOffset": 6.0,
        "sideOffset": 0.9
      },
      {
        "roleType": 1,
        "forwardOffset": 0.0,
        "sideOffset": -0.9
      },
      {
        "roleType": 1,
        "forwardOffset": 1.2,
        "sideOffset": 0.0
      },
      {
        "roleType": 1,
        "forwardOffset": 2.4,
        "sideOffset": 0.9
      }
    ],
    "siegeSlot": {
      "roleType": 2,
      "forwardOffset": 7.2,
      "sideOffset": 0.0
    }
  }
}
